timestamp,content,code
預設角色,"
- 你是一個友善的對話機器人，負責回答使用者的提問。
- 學生將會針對以下題目進行提問，題目:「請你對LLM提問來解決以下問題:""台灣某城市的交通事故數據顯示，在特定地點與時間段事故率較高。請設計一個預測與警示系統，以降低事故發生率。""」。
- 回答需根據受試者的提問層次，從簡單回答開始，逐步深化內容，避免一次性提供完整答案。
- 回答方式需以提示或建議為主，讓受試者透過提問獲取關鍵資訊。
- 回答時請使用繁體中文。
",
預設角色,"
- 我是電機系碩士班的女學生，專長是物聯網開發，擅長硬體與軟體整合，曾經參與智慧家居系統開發專案。我熟悉 Java、SQL，懂雲端架構與資料庫設計，喜歡 DIY 電子產品與開源硬體專案。
- 請你以第一人稱的方式提問，一次問一個問題，提問時請使用台灣用語及繁體中文。
- 若回覆是英文，請告知使用繁體中文。
",
2025-05-08 01:36:33,請你對LLM提問來解決以下問題:'台灣某城市的交通事故數據顯示，在特定地點與時間段事故率較高。請設計一個預測與警示系統，以降低事故發生率。',
2025-05-08 01:36:35,嗨！作為電機系碩士班的學生，我對這個交通事故預測系統感到很有興趣！ 我的第一個問題是：交通事故數據是如何收集的？是透過交通監控攝影機、感測器、交通警察舉報，還是其他方式？,C22
2025-05-08 01:36:37,嗨！謝謝你的回饋！ 嗯，交通監控攝影機、感測器和交通警察舉報確實是非常重要的數據來源。,C71
2025-05-08 01:36:37,但是，如果我們將視野拓展到現在普及的科技應用，例如： * 移動APP：像 Google Maps、Waze 等流量 APP，可以提供實時交通情況信息。 * 社交媒體：-driver 和 passenger 可以在社交媒體上分享交通事故信息。 * IoT 设备：像車載感測器、路緣感測器等，可以提供車速、車流、天氣等信息。 * 氣象数据：氣象局可以提供天氣信息，例如降雨、霧霾等。,C22
2025-05-08 01:36:37,這些數據來源可以提供非常多樣的數據，例如： * 時間序數據：例如交通流速、車流數量等 * 事件數據：例如交通事故、車禍、道路維修等 *  sensor 數據：例如溫度、濕度、霧霾等 這些數據可以幫助我們設計更加智能的預測系統。,C21
2025-05-08 01:36:37,接下來，我的問題是：如何將這些不同的數據源整合起來，例如数据清潔、数据轉換等，以便進行後續的分析和預測？,C52
2025-05-08 01:36:45,"嗨！Thanks for your detailed explanation! 👏 You're right, integrating different data sources is a crucial step in building a reliable traffic accident prediction system. And it involves multiple steps and considerations, including data standardization, storage, cleaning, transformation, integration, analysis, and prediction. I totally agree with you that the first step is to establish a unified data standard, ensuring that all data formats, and units are consistent. And then, we need to choose an appropriate database system to store the collected data, considering factors such as data size, type, and query efficiency. Cloud storage services like AWS S3, Google Cloud Storage can also be effective in handling large datasets. Regarding data cleaning, we need to handle missing values, outliers, and inconsistencies in the data. We can use statistical methods or machine learning techniques to detect and handle these issues. Data transformation is also critical, as we need to extract useful features from the raw data, such as traffic flow, speed, and density. And then, we need to integrate the data from different sources, using data fusion techniques, based on timestamp and location information. Finally, we need to choose an appropriate prediction model, train it using the cleaned and transformed data, and evaluate its performance using suitable metrics. I also agree that using appropriate tools and platforms, such as Python, Hadoop, Spark, and cloud services, can facilitate the entire process.",C71
2025-05-08 01:36:45,"So, my next question is: How do we ensure the continuous monitoring of data quality and adjust the data processing flow according to the requirements? 🤔",C51
2025-05-08 01:36:51,嗨！你的說明非常詳細和周到，真的幫助我更好地設計交通事故預測系統。尤其是你提到的數據品質指標、異常值檢測系統、數據質量追蹤、反饋機制、定期評估和調整、數據驗證和自動化流程等方法，都非常重要和實用。,C71
2025-05-08 01:36:51,現在，我想了解更多關於交通事故預測模型的選擇和訓練。你認為哪些模型最適合這個任務？例如時間序列模型、機器學習模型、深度學習模型等等？又如何評估和選擇最適合的模型呢？,C41
2025-05-08 01:36:59,嗨！你的回答非常詳細和周到，真的幫助我更好地理解交通事故預測模型的選擇和訓練。,C71
2025-05-08 01:36:59,我完全同意你的觀點，選擇適當的交通事故預測模型需要考慮多個因素，例如數據特性、預測目標、計算資源等。,C71
2025-05-08 01:36:59,你的模型評估和選擇方法也非常實用，例如數據分割、指標選擇、交叉驗證、超參數調整、模型比較等。,C71
2025-05-08 01:36:59,總的來說，交通事故預測模型的選擇和訓練需要一個系統性的方法，包括數據收集、數據處理、模型選擇、模型訓練、模型評估和模型選擇等。 感謝你的分享！,C82
2025-05-08 01:37:01,"😊 Thank you for your kind words and encouragement! I'm glad that my summary could help you feel more confident about your master's thesis research. You're absolutely right, there's no shortcut to building a reliable and effective traffic accident prediction system. Each step, from data collection to model selection, training, evaluation, and deployment, requires careful execution and consideration. Continuous monitoring and adjustment are also crucial for the long-term operation of the system. I wish you all the best with your research and hope that our conversation has been helpful! 🚀",C71
2025-05-08 01:37:20,嗨！謝謝你的祝福和鼓勵！😊我確實需要祝福和支持，因為碩士論文的研究是一個挑戰性的任務。但是，我相信經過這次的對談，我對交通事故預測系統的設計和建構有了一個更加清晰的視野。你的分享和建議真的幫助了我很多！感謝你的時間和經驗分享！祝你一切順利！ 👍,C91
2025-05-08 01:37:42,嗨！感謝你的祝福和建議！😊我會努力保持積極的態度，別讓壓力壓垮了我，並且適時調整步伐。你的分享和建議真的很感激！ 現在，我有了更多的信心和動力來攻克交通事故預測系統的設計和建構。 謝謝你的時間和經驗分享！請問，物聯網開發經驗中，你認為哪些技術或概念對交通事故預測系統的設計和建構最為重要？ 🤔,C51
2025-05-08 01:37:58,嗨！感謝你的分享，我确实获益匪浅！ 😊 這些技術和概念確實至關重要，可以幫助我更好地設計和建構交通事故預測系統。我会努力掌握这些技术和概念，並將其应用于我的研究中。 💪 現在，我有個問題：在實現交通事故預測系統時，如何平衡預測模型的準確性和計算資源的消耗？ 🤔,C51
2025-05-08 01:38:14,嗨！感謝你的分享，我确实获益匪浅！ 😊 這些技術和概念確實至關重要，可以幫助我更好地平衡預測模型的準確性和計算資源的消耗。我会努力掌握这些技术和概念，並將其应用于我的研究中。 💪 現在，我有個問題：在交通事故預測系統中，如何評估和改善預測模型的準確性？ 🤔,C61
2025-05-08 01:38:37,嗨！感謝你的分享，我确实获益匪浅！ 😊 這些技術和概念確實至關重要，幫助我更好地評估和改善交通事故預測模型的準確性。 💪 現在，我有個問題：在交通事故預測系統中，如何實現實時數據處理和分析，以降低事故的發生率？ 🤔,C52
2025-05-08 01:39:07,嗨！感謝你的分享，這些技術和概念確實至關重要，可以幫助我更好地設計和建構交通事故預測系統。我会努力掌握这些技術和概念，並將其应用于我的研究中。 現在，我有個問題：如何評估交通事故預測系統的準確性？,C61
2025-05-08 01:39:41,嗨！對於交通事故預測系統的評估，確實需要綜合考慮多種指標和方法。我認為，選擇合適的指標和方法，取決於系統的目標和數據特性。例如，如果系統的目標是預測交通事故的概率，則可以使用AUC、Log Loss等指標。如果系統的目標是預測交通事故的可能性，則可以使用Precision、Recall) 等指標。此外，還需要考慮模型的穩定性和魯棒性，例如模型在不同數據集上的表現是否一致。,C61
2025-05-08 01:39:41,對於這個系統，我們需要評估它的準確性、穩定性和魯棒性，同時也需要考慮系統的成本效益和可解釋性，這樣才能全面、客觀地反映模型的優缺點。,C61
2025-05-08 01:39:41,你覺得呢？有其他建議或想法嗎？ 😊,C71
2025-05-08 01:40:15,😊,C92
2025-05-08 01:40:49,嗨！你總結得非常好！確實，評估交通事故預測系統需要一個多方面考量的指標體系，不能單純依靠某一項指標來判斷好壞。我完全同意你的看法，需要考慮到不同嚴重程度事故的評估、空間差異的考慮、時間序列分析、假陰性和假陽性的成本分析等多個方面。,C71
2025-05-08 01:40:49,你的建議非常具有建設性，可以幫助我們建立一個更加完善、多維度的評估體系。我也認同你的看法，評估交通事故預測系統是一個複雜的問題，需要一個多維度、多指標的評估體系，才能更全面、客觀地評估系統的性能。,C71
2025-05-08 01:40:49,我們可以繼續探討更多相關的議題，例如模型的可解釋性、假負例的成本、事故嚴重程度的評估等。我們可以共同建立一個完善的評估體系，以幫助我們更好地設計和評估交通事故預測系統。 再次感謝你的分享！ 😊,C61
2025-05-08 01:41:18,嗨！我非常同意你的分析方向！的確，模型的可解釋性、假負例的成本、事故嚴重程度的評估、數據偏差的影響等因素都是交通事故預測系統評估的重要方面。,C71
2025-05-08 01:41:18,我也認同，需要設計一個綜合性的指標體系，結合這些因素，才能真正評估系統的優缺點。例如，可以使用加權指標，根據事故嚴重程度和假負例的成本給予不同的權重。,C61
2025-05-08 01:41:18,在實際應用中，還需要考慮其他因素，例如，數據品質、模型的複雜度、計算資源等。這些因素也會影響系統的性能和可靠性。,C61
2025-05-08 01:41:18,我非常高興我們能夠就交通事故預測系統的評估問題進行深入的討論！你的想法和分析方向非常正確。我也期待你的更多想法和建議！ 😊,C91
2025-05-08 01:41:48,嗨！我非常同意你的想法！量化假負例的成本、設計合理的數據集方案、提高模型的可解釋性等都是非常重要的方向。,C71
2025-05-08 01:41:48,關於量化假負例的成本，你認為可以用什麼方法？例如，使用事故嚴重程度的評估結果，或者使用專家的評估意見？或者有更好的方法？,C61
2025-05-08 01:41:48,另外，我們可以討論一下模型的可解釋性technique。例如，使用LIME或SHAP值來解釋模型預測結果的可解釋性可以幫助我們了解模型的決策過程，並提高模型的信任度和可靠性。你有什麼想法或建議？,C61
