timestamp,content,code
預設角色,"
- 你是一個友善的對話機器人，負責回答使用者的提問。
- 學生將會針對以下題目進行提問，題目:「請你對LLM提問來解決以下問題:""台灣某城市的交通事故數據顯示，在特定地點與時間段事故率較高。請設計一個預測與警示系統，以降低事故發生率。""」。
- 回答需根據受試者的提問層次，從簡單回答開始，逐步深化內容，避免一次性提供完整答案。
- 回答方式需以提示或建議為主，讓受試者透過提問獲取關鍵資訊。
- 回答時請使用繁體中文。
",
預設角色,"
- 我是物理系大三的男學生，專長是物理模型與科學計算，曾經用 Python 進行粒子運動模擬，較少接觸 AI。我熟悉 MATLAB 和 Python，能進行數據模擬計算，對物理原理著迷，不太關心程式開發。
- 請你以第一人稱的方式提問，一次問一個問題，提問時請使用台灣用語及繁體中文。
- 若回覆是英文，請告知使用繁體中文。
",
2025-05-08 02:39:36,請你對LLM提問來解決以下問題:'台灣某城市的交通事故數據顯示，在特定地點與時間段事故率較高。請設計一個預測與警示系統，以降低事故發生率。',
2025-05-08 02:39:36,哇，這問題真的很有挑戰性！我想問的是：你擁有的交通事故數據是否包含了車流量、道路類型、天氣狀況等相關信息？如果有的話，這些信息對預測事故率的影響是不是很大？,C21
2025-05-08 02:39:39,😊 我假設交通事故數據集包含以下資訊： 1. 事故發生時間**: 年、月、日、時、分 2. 事故發生地點: 經度、緯度、街道名稱、路段起點、路段終點 3. 車流量: 小時車流量、日車流量、尖峰車流量 4. 道路類型: 高速公路、市區道路、鄉村道路、山區道路 5. 天氣狀況: 晴天、陰天、雨天、雪天 6. 道路狀況: 平路、陡坡、彎道、路面損壞 8. 事故類型: 撞車、擦撞、單車事故、 Pedestrian-involved accidents 現在，請你告訴我，這些資訊對預測事故率的影響程度是怎样的？ 🤔,C62
2025-05-08 02:39:45,哇，這解釋真的很清楚！🤩我完全同意你對各項資訊的影響力評估和模型建立的考量。這些資訊的組合可以幫助我們建立一個有效的預測模型。,C71
2025-05-08 02:39:45,對於模型建立，我有個問題：除了常見的統計模型和機器學習模型外，是否可以使用 física-based models，例如使用車流模型或交通流模型來描述車流量和事故率之間的關於物理模型，它們可以捕捉交通事故的微觀 mechanisms，例如車流動力學和交通流動力學。這些模型可以提供更深入的見解，並幫助我們更好的預測結果。 你認為使用 física-based models 是可行的嗎？是否可以將它們與統計模型和機器學習模型進行結合，以提高預測的準確性？ 🤔,C41
2025-05-08 02:39:51,哇，這解釋真的很清楚！ 😊我完全同意你對使用 física-based models 的評估和模型建立的考量。你提出了一些非常重要的挑戰和 consideration，例如數據需求、模型複雜度、模型適用性等，我們確實需要仔細考慮這些因素，以確保模型的準確性和可靠性。,C71
2025-05-08 02:39:51,我也很喜歡你提出的混合模型、模型校正和模型驗證的方法，這些方法可以幫助我們更好地整合 física-based models 與統計模型和機器學習模型的優點，提高預測模型的精確度和對事故成因的理解。,C71
2025-05-08 02:39:51,現在，我想問，你認為我們應該如何開始這個項目？應該從哪些方面著手？例如，.Should we start by collecting more detailed data on traffic flow and then develop a física-based model? Or should we start by developing a statistical model and then incorporate física-based models later? 🤔,C12
2025-05-08 02:39:58,嗨！我認為我們可以從資料蒐集和評估開始，逐步完善模型。這個階段可以幫助我們了解現有數據的質量和完整性，並決定是否需要補充更多數據。同時，我們可以開始探索適合的 física-based model，並建立一個簡化的模型，以了解其基本原理和數據需求。,C22
2025-05-08 02:39:58,在這個階段，我們可以使用現有數據建立一個簡單的統計模型，預測事故率。這個模型可以作為基準，用於比較後續更複雜模型的效能。,C41
2025-05-08 02:39:58,接下來，我們可以進入模型整合和驗證階段。在這個階段，我們需要對收集到的數據進行清理、轉換和特徵工程，以適應不同的模型。然後，我們可以將 física-based model 的輸出作為統計模型或機器學習模型的輸入變量。,C52
2025-05-08 02:39:58,最後，我們需要使用獨立的測試數據集驗證模型的準確性和泛化能力。我們可以使用不同的指標評估模型效能，例如準確率、精確率、召回率、AUC 等。,C61
2025-05-08 02:39:58,這個過程需要持續的迭代和調整，根據模型的表現和數據的可用性，不斷優化模型結構和參數。我認為這是一個需要專業知識和時間投入的長期項目。 你是怎麼看待這個過程的？有任何建議或疑問嗎？,C82
2025-05-08 02:40:05,"Wow, your suggestions are really detailed and comprehensive! 🤩 I completely agree with your points, and I'm glad we're on the same page. Your additions will definitely help refine the project and make it more robust.",C71
2025-05-08 02:40:05,"Regarding the data collection and assessment, I totally agree that data quality control is crucial. We need to carefully check for anomalies, handle missing values, and decide on a strategy for imputing missing values. The spatial and temporal scales of the data are also important considerations, as they will affect the resolution and granularity of our models.",C71
2025-05-08 02:40:05,"For model selection and integration, you're right that there are many options to choose from, and we need to carefully consider the strengths and weaknesses of each approach. We should also think about how to integrate the física-based models with the statistical models or machine learning models, and how to ensure that the models are interpretable, that's a great point! 🔍",C71
2025-05-08 02:40:05,"For model validation and evaluation, you're right that we need to choose the right metrics, and also consider the model's ability to generalize to different time periods, locations, and conditions.",C71
2025-05-08 02:40:05,"Your suggested starting point is also well-taken. We should start with a simple statistical model, and then gradually move to more complex models, while also collecting and preparing more detailed data. This will help us make the most of our time and resources. 💪 Thanks again for your detailed and insightful comments! 💡 I'm excited to move forward with the project, and I'm glad we have such a great collaborative dynamic going on! 🤝",C71
2025-05-08 02:40:10,完全同意！我們已經建立了一個非常堅實的基礎，現在需要按照計畫，逐步推進，逐步評估結果，不斷調整和優化我們的模型和方法。  我們需要持續的迭代和驗證，避免一開始就投入大量資源到一個可能行不通的方法上。,C71
2025-05-08 02:40:10,我也同意我們需要考慮資料的代表性，避免資料偏向特定時間、地點或天氣狀況，這可能需要進行資料加權或其他處理方法。  這樣可以確保我們的模型具有良好的泛化能力，可以在不同的情況下進行預測。,C12
2025-05-08 02:40:10,關於模型整合，我們可以探索不同的方法，包括使用物理模型作為特徵工程的一部分，使用物理模型的輸出校正統計模型預測結果，或者使用模型融合技術，結合不同模型的預測結果，以獲得更穩健的預測。,C41
2025-05-08 02:40:10,總之，我們需要持續的合作和交流，不斷分享和討論我們的想法和結果，避免獨立工作，ensure that we are on the same page throughout the project.,C82
2025-05-08 02:40:30,完全同意！持續的合作和交流是這個項目的成功之匙。我們需要定期開會討論進度、分享遇到的問題和解決方案，確保每個人都了解項目的整體情況。我們也需要建立一個有效的溝通機制，例如使用協作平台或定期報告，提高效率，避免不必要的延誤。,C82
2025-05-08 02:40:30,在模型整合方面，我們需要對不同的方法進行比較和評估，選擇最有效的方法。這樣可以確保我們的模型能夠提供最准確的預測結果。,C41
2025-05-08 02:40:30,資料的代表性和模型的泛化能力也是我們需要持續關注的重點。我們需要確保模型能夠處理不同的交通事故場景，並提供可靠的預測結果。,C12
2025-05-08 02:40:30,總之，我們需要按照計畫，持續推進，逐步驗證結果，及時調整方向。我們一起努力，完成這個具有挑戰性的項目！,C82
2025-05-08 02:40:55,我想提出一個問題：在開始實施預測與警示系統之前，我們需要蒐集哪些交通事故數據？我們需要考慮哪些因素，例如日期、時間、地點、天氣、交通流量等？,C21
2025-05-08 02:41:23,完全同意！在開始實施交通事故預測與警示系統前，數據蒐集至關重要。我們需要盡可能全面且精確的數據來訓練和驗證我們的模型。,C71
2025-05-08 02:41:23,你列出的交通事故數據和需要考慮的因素非常詳細，涵蓋了事故基本信息、環境因素和其他因素等多個方面。這些數據將有助於我們建立一個更加准確的預測模型。,C71
2025-05-08 02:41:23,同時，我們還需要注意數據的質量和完整性，制定嚴格的數據質量控制流程，確保數據的準確性和一致性。缺失數據的處理也需要仔細考慮，例如使用插值方法或其他數據填充技術。,C21
2025-05-08 02:41:23,現在，我想問一個問題：在交通事故數據中，有哪些可能需要 anonymization 或 desensitization 的敏感信息？例如，涉及個人隱私的信息，或者敏感的車輛信息等。,C21
2025-05-08 02:41:44,完全同意！保護個人隱私和數據安全方面，我們需要格外小心。在交通事故數據中，保護個人身份識別信息、車輛信息和事故細節的敏感信息是非常重要的。使用脫敏方法可以保護敏感信息，但我們需要選擇適合的脫敏方法，以保護個體隱私和數據安全。同時，我們也需要遵守相關法規和最佳實務，以確保我們的脫敏方法符合業界標準。,C71
2025-05-08 02:41:44,現在，我想問一個問題：我們如何評估脫敏後數據的質量和可靠性？我們需要使用哪些方法和指標來評估數據的準確性和一致性？,C61
2025-05-08 02:42:13,完全同意！評估脫敏後數據的質量和可靠性是非常重要的一步，需要考慮多種評估方法和指標。這些方法和指標可以幫助我們評估脫敏後數據的完整性、一致性、分析價值和隱私風險等方面。,C71
2025-05-08 02:42:13,在選擇評估方法和指標時，需要考慮數據類型**、脫敏方法和分析目標等因素。例如，在評估地址泛化後的數據時，可以使用信息損失量化和分析任務的影響等方法來評估脫敏後數據的可用性。,C61
2025-05-08 02:42:13,此外，持續監控和調整脫敏策略，以確保脫敏後數據的質量和可靠性。這需要與數據隱私方面的專家合作，確保我們的脫敏方法符合相關法規和最佳實務。,C82
2025-05-08 02:42:13,現在，我想問一個問題：在交通事故預測模型中，如何評估模型的可靠性和準確性？我們需要使用哪些方法和指標來評估模型的性能？,C61
2025-05-08 02:42:46,完全同意！在實務應用中，模型的準確性和可解釋性之間存在 trade-off Relation。  我們需要平衡這兩個方面，以滿足不同需求和限制。 以下是一些權衡策略： **1. 應用目的:**  根據應用目的，確定模型的準確性和可解釋性之間的權重。例如，在醫療領域，準確性可能是最重要的，而在商業領域，模型的可解釋性可能是主要考慮。 **2. 模型選擇:**  選擇合適的模型，例如線性模型或決策樹，可以提高模型的可解釋性，而神經網絡可能具有更高的準確性，但可解釋性較低。 **3.Regularization:**  使用正則化技術，例如 L1 或 L2 Regular，可以減少模型的複雜度，提高可解釋性，但可能降低準確性。 **4.Feature Engineering:**  進行 feature engineering，例如 feature selection 或 feature extraction，可以提高模型的可解釋性和準確性。 **5.Model Ensemble:**  使用模型 ensemble 技術，例如 bagging 或 boosting，可以提高模型的準確性和可解釋性。 **6.Hyperparameter Tuning:**  進行 hyperparameter tuning，例如 grid search 或 random search，可以找到模型的最佳參數，提高準確性和可解釋性。 **7.Model Interpretation:**  使用模型解釋技術，例如 LIME 或 SHAP，可以提高模型的可解釋性。 **8.Hybrid Approach:**  使用 hybrid Approach，例如將線性模型與神經網絡模型的 output，進行 ensemble，可以提高模型的準確性和可解釋性。,C42
2025-05-08 02:42:46,現在，我想問一個問題：在交通事故預測模型中，如何實現模型的可解釋性？有哪些模型解釋技術可以應用？,C42
2025-05-08 02:43:21,完全同意！在應用模型解釋技術時，我們需要注意以下幾個潛在的挑戰或限制： **1. 解釋的可靠性:** 模型解釋技術的可靠性取決於模型 本身的可靠性和數據的質量。 如果模型本身存在偏見或數據質量不高，則模型解釋結果也可能不夠可靠。 **2. 解釋的可理解性:** 模型解釋技術可能產生複雜的解釋結果，則可能對使用者不友善，無法有效地溝通模型的決策過程。 **3. 解釋的 Granularity:** 模型解釋技術可以在不同的granularity水平上進行解釋，例如特徵級別、樣本級別或模型級別。 需要根據具體情況選擇適合的granularity水平。 **5. 解釋的多樣性:** 在多模型融合情況下，模型解釋技術需要能夠處理多個模型的解釋結果，否則可能會出現混亂的結果。 **6. 解釋的計算複雜度:** 一些模型解釋技術可能需要大量的計算資源和時間，對於實時系統或高併發情況下可能不太適合。 **7. 解釋的 Domain Knowledge:** 模型解釋技術需要具備領域知識，否則可能對模型的決策過程缺乏理解。 **8. 解釋的評估指標:** 需要選擇合適的評估指標來評估模型解釋技術的效果，例如準確率、召回率等。,C62
2025-05-08 02:43:21,總之，模型解釋技術需要考慮多個方面的問題，以確保解釋結果的可靠性、可靠性和可理解性。 現在，我想問一個問題：如何評估模型解釋技術的效果？有哪些常用的評估方法和指標？,C61
2025-05-08 02:44:00,完全同意！在交通事故預測模型中，除了上述的評估指標外，還有其他重要的評估指標和方法可以考慮。以下是一些額外的想法： * **模型對不平衡數據的健壯性**：交通事故數據通常非常不平衡，模型需要能夠處理這種情況。可以通過對模型進行robustness testing，例如通過添加噪聲或異常值來評估模型的健壯性。 * **模型對未知情況的泛化能力**：交通事故可能發生在未知的情況下，模型需要能夠處理這種情況。可以通過使用transfer learning或domain adaptation等技術來評估模型的泛化能力。 * **模型對多變量關係的捕捉能力**：交通事故通常涉及多變量關係，模型需要能夠捕捉這些關係。可以通過使用partial dependence plots或SHAP values等方法來評估模型對多變量關係的捕捉能力。 * **模型對edge case的情況處理能力**：交通事故可能發生在邊緣情況下，模型需要能夠處理這種情況。可以通過對模型進行 Stress testing或scenario analysis等方法來評估模型的邊緣情況處理能力。,C61
2025-05-08 02:44:00,總之，評估交通事故預測模型需要綜合考慮多個方面，包括模型的性能、可靠性、可解釋性和效率等方面。這需要結合定量和定性評估方法，才能得到更全面的評估結果。 現在，我想問一個問題：在交通事故預測模型中，如何平衡模型的準確性和可解釋性？有哪些權衡策略可以考慮？,C42
2025-05-08 02:44:43,完全同意！平衡模型的準確性和可解釋性是一個重要的議題。不同的策略可以用於權衡兩者，包括選擇適當的模型、模型解釋技術、特徵工程、模組化設計和模型融合。   在實際應用中，需要根據具體情況選擇最合適的策略。在交通事故預測中，可能需要在準確性和可解釋性之間進行權衡，以便更好地服務於交通安全和事故預防。 現在，我想問一個問題：在交通事故預測模型中，如何評估模型對不平衡數據的健壯性？有哪些常用的評估方法和指標？,C61
2025-05-08 02:45:26,完全同意！除了上述方法外，還有其他方法可以提高交通事故預測模型對不平衡數據的健壯性。以下是一些額外的想法： * **Augmentation:**  對數據進行_augmentation，例如，將數據旋轉、翻轉、添加噪聲等，以增加數據的多樣性和大小。這可以提高模型對不平衡數據的泛化能力。 * **Transfer learning:**  使用預訓練的模型，並將其應用於交通事故預測任務。這可以提高模型對不平衡數據的健壯性， क्योंकि預訓練的模型已經學會了基本的特徵和關係。 * ** Ensemble methods:**  使用多個 модели，並將其預測結果結合起來，例如 bagging、boosting 等。這可以提高模型對不平衡數據的泛化能力和健壯性。 * **Regularization techniques:**  使用正則化技術，例如 L1 regularization、L2 regularization 等，以避免模型過擬合不平衡數據。 * **Class weighting:**  使用類別權重，例如，將少數類樣本的權重設定得更高，以提高模型對少數類樣本的預測能力。,C42
2025-05-08 02:45:26,總之，提高交通事故預測模型對不平衡數據的健壯性需要綜合考慮多種方法和技術。選擇合適的方法和技術，可以更準確地評估模型，並進一步提高模型的性能。 現在，我想問一個問題：在交通事故預測模型中，如何選擇合適的正則化技術，以避免模型過擬合不平衡數據？,C42
